{
  "mode": "create",
  "planning_window": {
    "start": "2026-10-05T00:00:00+02:00",
    "duration": 604800
  },
  "preferences": {
    "timezone": "Europe/Warsaw",
    "starting_comfort": "starting_out",
    "sessions_per_week": 3,
    "activity_interests": [1, 2],
    "available_locations": ["outdoors", "gym"],
    "available_equipment": [],
    "preferred_times": ["lunch", "evening"],
    "discovery_preference": "selected_only",
    "avoidances": ["jumping"],
    "starting_obstacle": "time",
    "excluded_activity_types": [],
    "comfortable_swimming": null,
    "preferred_duration": 600
  },
  "available_slots": [
    {
      "start": "2026-10-05T12:00:00+02:00",
      "duration": 1800
    }
  ],
  "user_description": "A beginner who works at a desk and wants a gentle start.",
  "sports": [
    {
      "id": 1,
      "is_gym": 0,
      "name": "Walking",
      "description": "Easy outdoor walking",
      "metrics": [
        {
          "key": "duration",
          "description": "Total workout duration in seconds",
          "unit": "seconds",
          "required": true,
          "represents_session_duration": true,
          "value_schema": {
            "type": "integer",
            "minimum": 1
          }
        },
        {
          "key": "distance",
          "description": "Estimated total distance",
          "unit": "metres",
          "required": false,
          "value_schema": {
            "type": "number",
            "minimum": 0
          }
        }
      ]
    },
    {
      "id": 2,
      "is_gym": 1,
      "name": "Gym",
      "description": "Gentle beginner gym exercises"
    }
  ],
  "previous_week_events": [],
  "current_week_events": [],
  "target_window_events": [],
  "conversation": [],
  "user_prompt": null
}
